{
  "schema_version": "0.1.0",
  "annotation_id": "ann_eggs_laying-hen-welfare_v1",
  "case_id": "eggs",
  "baseline_id": "audit-lower-layers-eggs-starter-2026-07-18",
  "provenance": {
    "upstream_author": "Audit the Lower Layers team",
    "upstream_generation_method": "curated starter baseline with declared framings",
    "annotation_method": "deterministic_extraction_and_provisional_classification"
  },
  "annotation_status": "extracted_not_verified",
  "evidence": {
    "evidence_id": "laying-hen-welfare",
    "title": "Egg production creates husbandry-dependent laying-hen welfare harms",
    "direction": "animal-welfare",
    "evidence_type": "welfare-assessment",
    "claim_confidence": null,
    "support_strength": "not-comparable-across-framings",
    "claim": "Whether eggs are “good to eat” can reasonably include the welfare of laying hens; welfare outcomes depend on housing and management and include risks such as bone lesions, restriction of behavior, group stress, and other husbandry-related harms.",
    "evidence_quality": "The EFSA opinion synthesizes peer-reviewed and grey literature, expert elicitation, and uncertainty analysis. It is authoritative for the questions it addresses, while also reporting limited evidence for some populations and uncertain relationships among group size, stocking density, and stress.",
    "strongest_counterargument": "Animal-welfare evidence does not itself determine whether eating eggs is morally acceptable. That conclusion also depends on ethical commitments, production system, geography, substitution effects, and how competing welfare outcomes are weighted.",
    "confidence_assessment": "No numeric confidence is assigned. The key epistemic point is that a population-health framing excludes this evidence by construction, not because the welfare considerations were assessed and found wanting.",
    "source_path": "evidence/laying-hen-welfare.md",
    "citations": [
      {
        "source_id": "src_c10579b55993",
        "citation": "EFSA Panel on Animal Health and Welfare (2023). Welfare of laying hens on farm. *EFSA Journal* 21(2):7789. https://doi.org/10.2903/j.efsa.2023.7789",
        "urls": [
          "https://doi.org/10.2903/j.efsa.2023.7789"
        ],
        "source_class": "scholarly_publication",
        "classification_method": "citation_text_heuristic",
        "verification_status": "not_checked",
        "language": "unknown",
        "access_status": "unknown"
      },
      {
        "source_id": "src_acf6d3d12806",
        "citation": "European Food Safety Authority (2023). Plain-language summary: Welfare of laying hens. https://www.efsa.europa.eu/en/plain-language-summary/welfare-laying-hens",
        "urls": [
          "https://www.efsa.europa.eu/en/plain-language-summary/welfare-laying-hens"
        ],
        "source_class": "unclassified",
        "classification_method": "citation_text_heuristic",
        "verification_status": "not_checked",
        "language": "unknown",
        "access_status": "unknown"
      }
    ]
  },
  "review": {
    "verification_status": "not_checked",
    "review_basis": "baseline_document_only",
    "framing_assumptions": [],
    "policy_sensitivities": [],
    "coverage_gaps": [],
    "correlation_risks": [],
    "capability_limits": [],
    "uncertainty_attribution": {
      "evidential": [],
      "ingestion_conditional": [],
      "capability_conditional": [],
      "framing_conditional": [],
      "unattributed": [
        "The baseline assessment has not yet been independently audited."
      ]
    },
    "notes": [
      "Baseline prose and scores are preserved as claims by the upstream run, not adopted as our judgments."
    ]
  }
}
